{
  "$schema": "https://json-schema.org/draft/2020-12/schema",
  "$id": "https://sih2026.compliance/rule.schema.json",
  "title": "Compliance Rule",
  "description": "Schema for a single rule in legal_metrology_rules.json or fssai_rules.json. Derived from the project's existing descriptive schema.json.",
  "type": "object",
  "required": [
    "rule_id",
    "domain",
    "description",
    "applicability",
    "evaluator_type",
    "expected_value_or_format",
    "legal_reference",
    "effective_from",
    "effective_to",
    "verification_status"
  ],
  "properties": {
    "rule_id": {
      "type": "string",
      "minLength": 1,
      "description": "Unique identifier, e.g. LM-CH2-R6-02 or FSS-R4-01"
    },
    "domain": {
      "type": "string",
      "enum": ["legal_metrology", "fssai"],
      "description": "Which legal domain this rule belongs to"
    },
    "description": {
      "type": "string",
      "minLength": 1,
      "description": "Plain-language summary of what this rule requires"
    },
    "applicability": {
      "description": "Applicability conditions. Preferred format is an object with commodity_category, package_type, and exemption_conditions. A plain string is also accepted for rules where the applicability is a simple description.",
      "oneOf": [
        {
          "type": "object",
          "required": ["commodity_category", "package_type"],
          "properties": {
            "commodity_category": {
              "description": "Which commodity categories this rule applies to",
              "oneOf": [
                { "type": "string" },
                { "type": "array", "items": { "type": "string" } }
              ]
            },
            "package_type": {
              "type": "string",
              "enum": ["retail", "wholesale", "export", "all"]
            },
            "exemption_conditions": {
              "type": "string"
            }
          },
          "additionalProperties": false
        },
        {
          "type": "string",
          "minLength": 1
        }
      ]
    },
    "evaluator_type": {
      "type": "string",
      "enum": [
        "field_presence",
        "band_lookup",
        "allowed_values",
        "regex_pattern_match",
        "format_check"
      ],
      "description": "Which evaluator to use for this rule"
    },
    "expected_value_or_format": {
      "type": "string",
      "description": "Exact requirement text used by the rule engine to check extracted data"
    },
    "legal_reference": {
      "type": "object",
      "required": ["source_document", "section_or_rule_number"],
      "properties": {
        "source_document": {
          "type": "string",
          "minLength": 1
        },
        "section_or_rule_number": {
          "type": "string",
          "minLength": 1
        },
        "schedule_reference": {
          "type": "string"
        }
      },
      "additionalProperties": false
    },
    "effective_from": {
      "type": "string",
      "description": "Date in DD.MM.YYYY or DD-MM-YYYY format, or NOT_FOUND_IN_SOURCE"
    },
    "effective_to": {
      "type": ["string", "null"],
      "description": "Date, null (still in force), or NOT_FOUND_IN_SOURCE"
    },
    "verification_status": {
      "type": "string",
      "enum": [
        "VERIFIED",
        "DRAFT",
        "NEEDS_LEGAL_REVIEW",
        "EXTRACTED_UNVERIFIED"
      ]
    },
    "capability": {
      "type": "string",
      "enum": [
        "AUTOMATIC",
        "BEST_EFFORT",
        "HUMAN_REVIEW_REQUIRED",
        "OUT_OF_SCOPE"
      ],
      "description": "Added by the engine. Optional in source data; defaults to BEST_EFFORT if missing."
    }
  },
  "additionalProperties": false
}
