[
  {
    "rule_id": "LM-R1",
    "domain": "legal_metrology",
    "description": "Rules are called The Legal Metrology (Packaged Commodities) Rules, 2011 and came into force on 1 April 2011.",
    "applicability": {
      "commodity_category": "all",
      "package_type": "all",
      "exemption_conditions": "NOT_FOUND_IN_SOURCE"
    },
    "evaluator_type": "format_check",
    "expected_value_or_format": "Rule title: The Legal Metrology (Packaged Commodities) Rules, 2011; commencement: 01-04-2011.",
    "legal_reference": {
      "source_document": "Legal Metrology (Packaged Commodities) Rules 2011",
      "section_or_rule_number": "Rule 1(1)-(2)",
      "schedule_reference": "NOT_FOUND_IN_SOURCE"
    },
    "effective_from": "01-04-2011",
    "effective_to": "NOT_FOUND_IN_SOURCE",
    "verification_status": "EXTRACTED_UNVERIFIED"
  },
  {
    "rule_id": "LM-R2",
    "domain": "legal_metrology",
    "description": "Rule 2 defines the terms used throughout these Rules, including Act, dealer, lot, manufacturer, maximum permissible error, net quantity, packer, principal display panel, quantity, retail dealer, retail package, retail sale, retail sale price, section, Schedule, standard package, wholesale dealer and wholesale package. Undefined terms that are defined in the Act have the meanings assigned in the Act.",
    "applicability": {
      "commodity_category": "all",
      "package_type": "all",
      "exemption_conditions": "NOT_FOUND_IN_SOURCE"
    },
    "evaluator_type": "field_presence",
    "expected_value_or_format": "Definitions shall be interpreted according to Rule 2; wholesale package includes the categories specified in Rule 2(r).",
    "legal_reference": {
      "source_document": "Legal Metrology (Packaged Commodities) Rules 2011",
      "section_or_rule_number": "Rule 2(a)-(r)",
      "schedule_reference": "First Schedule is incorporated into the definition of maximum permissible error."
    },
    "effective_from": "01-04-2011",
    "effective_to": "NOT_FOUND_IN_SOURCE",
    "verification_status": "EXTRACTED_UNVERIFIED"
  },
  {
    "rule_id": "LM-CH2-R3-01",
    "domain": "legal_metrology",
    "description": "Chapter II does not apply to packages containing more than 25 kg or 25 litre, except cement and fertilizer sold in bags up to 50 kg.",
    "applicability": {
      "commodity_category": "Packaged commodities intended for retail sale",
      "package_type": "retail",
      "exemption_conditions": "Packages containing more than 25 kg or 25 litre are outside Chapter II; exception stated for cement and fertilizer sold in bags up to 50 kg."
    },
    "evaluator_type": "format_check",
    "expected_value_or_format": "Chapter II applicability must be excluded when quantity >25 kg or >25 litre, subject to the stated cement/fertilizer exception.",
    "legal_reference": {
      "source_document": "Legal Metrology (Packaged Commodities) Rules 2011",
      "section_or_rule_number": "Rule 3(a)",
      "schedule_reference": "NOT_FOUND_IN_SOURCE"
    },
    "effective_from": "01.04.2011",
    "effective_to": "NOT_FOUND_IN_SOURCE",
    "verification_status": "EXTRACTED_UNVERIFIED"
  },
  {
    "rule_id": "LM-CH2-R3-02",
    "domain": "legal_metrology",
    "description": "Chapter II does not apply to packaged commodities meant for industrial consumers or institutional consumers.",
    "applicability": {
      "commodity_category": "Packaged commodities meant for industrial or institutional consumers",
      "package_type": "retail",
      "exemption_conditions": "Industrial and institutional consumer packages are excluded from Chapter II."
    },
    "evaluator_type": "format_check",
    "expected_value_or_format": "Chapter II applicability = excluded for industrial/institutional consumer packages.",
    "legal_reference": {
      "source_document": "Legal Metrology (Packaged Commodities) Rules 2011",
      "section_or_rule_number": "Rule 3(b)",
      "schedule_reference": "NOT_FOUND_IN_SOURCE"
    },
    "effective_from": "01.04.2011",
    "effective_to": "NOT_FOUND_IN_SOURCE",
    "verification_status": "EXTRACTED_UNVERIFIED"
  },
  {
    "rule_id": "LM-CH2-R4-01",
    "domain": "legal_metrology",
    "description": "A person shall not pre-pack or cause or permit a commodity to be pre-packed for sale, distribution or delivery unless the package or securely affixed label bears the declarations required by the Rules.",
    "applicability": {
      "commodity_category": "Commodities in packaged form",
      "package_type": "retail",
      "exemption_conditions": "Packages covered by Chapter II; manufacturer-premises exception concerning absence of retail sale price is stated separately."
    },
    "evaluator_type": "field_presence",
    "expected_value_or_format": "All declarations required by the Rules must be present on the package or securely affixed label.",
    "legal_reference": {
      "source_document": "Legal Metrology (Packaged Commodities) Rules 2011",
      "section_or_rule_number": "Rule 4",
      "schedule_reference": "NOT_FOUND_IN_SOURCE"
    },
    "effective_from": "01.04.2011",
    "effective_to": "NOT_FOUND_IN_SOURCE",
    "verification_status": "EXTRACTED_UNVERIFIED"
  },
  {
    "rule_id": "LM-CH2-R4-02",
    "domain": "legal_metrology",
    "description": "Packages existing without a retail sale price declaration within the manufacturer's premises are not treated as violating the Rules, but all packages leaving the manufacturer's premises for destination must bear the required retail sale price declaration.",
    "applicability": {
      "commodity_category": "Packaged commodities",
      "package_type": "retail",
      "exemption_conditions": "Temporary absence of retail sale price is permitted while packages remain within the manufacturer's premises."
    },
    "evaluator_type": "field_presence",
    "expected_value_or_format": "Retail sale price declaration must be present when package leaves manufacturer's premises.",
    "legal_reference": {
      "source_document": "Legal Metrology (Packaged Commodities) Rules 2011",
      "section_or_rule_number": "Rule 4, Explanation",
      "schedule_reference": "NOT_FOUND_IN_SOURCE"
    },
    "effective_from": "01.04.2011",
    "effective_to": "NOT_FOUND_IN_SOURCE",
    "verification_status": "EXTRACTED_UNVERIFIED"
  },
  {
    "rule_id": "LM-CH2-R5-01",
    "domain": "legal_metrology",
    "description": "Commodities specified in the Second Schedule shall be packed for sale, distribution or delivery in the standard quantities specified in that Schedule.",
    "applicability": {
      "commodity_category": "Commodities specified in the Second Schedule",
      "package_type": "retail",
      "exemption_conditions": "Applies to commodities listed in the Second Schedule."
    },
    "evaluator_type": "band_lookup",
    "expected_value_or_format": "Package quantity must correspond to the applicable standard quantity specified in the Second Schedule.",
    "legal_reference": {
      "source_document": "Legal Metrology (Packaged Commodities) Rules 2011",
      "section_or_rule_number": "Rule 5",
      "schedule_reference": "Second Schedule"
    },
    "effective_from": "01.04.2011",
    "effective_to": "NOT_FOUND_IN_SOURCE",
    "verification_status": "EXTRACTED_UNVERIFIED"
  },
  {
    "rule_id": "LM-CH2-R5-02-HISTORICAL",
    "domain": "legal_metrology",
    "description": "The source contains a proviso requiring a prominent declaration that the package is not a standard pack size when a Second Schedule commodity is packed in a size other than prescribed. The source expressly states that this proviso was withdrawn with effect from 01.07.2012.",
    "applicability": {
      "commodity_category": "Commodities specified in the Second Schedule packed in non-prescribed sizes",
      "package_type": "retail",
      "exemption_conditions": "Historical requirement only; source states withdrawal effective 01.07.2012."
    },
    "evaluator_type": "field_presence",
    "expected_value_or_format": "Historical declaration: 'Not a standard pack size under the Legal Metrology (Packaged Commodities) Rules, 2011' or 'non standard size under the Legal Metrology (packaged Commodities) Rules, 2011'.",
    "legal_reference": {
      "source_document": "Legal Metrology (Packaged Commodities) Rules 2011",
      "section_or_rule_number": "Rule 5 proviso",
      "schedule_reference": "Second Schedule"
    },
    "effective_from": "01.04.2011",
    "effective_to": "30.06.2012",
    "verification_status": "EXTRACTED_UNVERIFIED"
  },
  {
    "rule_id": "LM-CH2-R6-01",
    "domain": "legal_metrology",
    "description": "Every package must bear a definite, plain and conspicuous declaration in accordance with Chapter II.",
    "applicability": {
      "commodity_category": "Every package covered by Chapter II",
      "package_type": "retail",
      "exemption_conditions": "Subject to specific exemptions/provisos in Rule 6."
    },
    "evaluator_type": "field_presence",
    "expected_value_or_format": "Required declarations must be definite, plain and conspicuous.",
    "legal_reference": {
      "source_document": "Legal Metrology (Packaged Commodities) Rules 2011",
      "section_or_rule_number": "Rule 6(1)",
      "schedule_reference": "NOT_FOUND_IN_SOURCE"
    },
    "effective_from": "01.04.2011",
    "effective_to": "NOT_FOUND_IN_SOURCE",
    "verification_status": "EXTRACTED_UNVERIFIED"
  },
  {
    "rule_id": "LM-CH2-R6-02",
    "domain": "legal_metrology",
    "description": "The package must declare the name and address of the manufacturer; where the manufacturer is not the packer, the name and address of both manufacturer and packer; and for an imported package, the name and address of the importer.",
    "applicability": {
      "commodity_category": "Packaged commodities",
      "package_type": "retail",
      "exemption_conditions": "Food articles are subject to the alternative requirement identified in Rule 6(1)(a) Explanation III."
    },